{
  "name": "Iron Condor",
  "slug": "iron_condor",
  "category": "options_selling",
  "underlying": ["NIFTY"],
  "description": "Defined-risk neutral strategy: short strangle plus long wings for capped loss on Nifty monthly expiries.",
  "hypothesis": "Monthly Nifty range is bounded; selling body strikes and buying far OTM wings improves risk-adjusted returns vs naked strangle.",
  "entry_rules": {
    "conditions": [
      "IV rank above 40 on monthly series",
      "Short call at +1.5 SD, short put at -1.5 SD",
      "Long call 100-200 points above short call, long put 100-200 points below short put",
      "Enter 15-20 DTE"
    ],
    "position_sizing": "Max risk per condor = wing width minus net credit; size to 1% account risk"
  },
  "exit_rules": {
    "stop_loss": "2x net credit or 50% of max loss",
    "target": "50% of max profit",
    "time_exit": "Close at 7 DTE if neither side threatened"
  },
  "risk_params": {
    "max_loss_per_trade": "Wing width minus credit received",
    "margin_required": "Lower than naked strangle due to long wings"
  },
  "market_conditions": {
    "volatility_regime": "Moderate to high IV",
    "trend": "Range-bound; avoid strong breakout trends"
  },
  "backtest_results": {
    "period": "2019-2024 Nifty monthly",
    "win_rate": 0.72,
    "sharpe": 1.65,
    "max_drawdown": 0.09,
    "profit_factor": 1.8
  },
  "notes": "Prefer monthly over weekly for Nifty. Adjust wing width based on VIX level.",
  "tags": ["defined risk", "neutral", "monthly", "Nifty"]
}
